{
  "businessTransactionId": "txn-000002",

  "metadata": {
    "businessTransactionId": "txn-000002",
    "correlationId": "corr-000002",
    "createdBy": "tutorial-62",
    "createdAt": "2026-01-01T00:00:00Z"
  },

  "authority": {
    "authorityId": "authority-001",
    "authorityType": "USER",
    "principalId": "john.doe",
    "displayName": "John Doe",
    "issuedAt": "2026-01-01T00:00:00Z"
  },

  "authorization": {
    "authorizationId": "authorization-001",
    "authorityId": "authority-001",
    "purpose": "Vendor Payment",
    "authorizedAt": "2026-01-01T00:00:00Z"
  },

  "intent": {
    "intentId": "intent-001",
    "authorizationId": "authorization-001",

    "action": "vendor-payment",

    "target": "sap.payment.release",

    "parameters": {
      "invoiceId": "invoice-1001",
      "vendorId": "vendor-1001",
      "amount": 5000,
      "currency": "USD"
    },

    "createdAt": "2026-01-01T00:00:00Z"
  },

  "policy": {
    "name": "vendor-payment",
    "version": "2.1.0",
    "schemaVersion": "1.0.0"
  },

  "signals": {
    "vendorVerified": true,
    "invoiceVerified": true,
    "paymentApproved": true,
    "sufficientFunds": true,
    "paymentAmount": 5000,
    "riskScore": 10,
    "vendorId": "sap.payment.release"
  },

  "status": "RECEIVED",

  "createdAt": "2026-01-01T00:00:00Z"
}
