{
  "businessTransactionId": "txn-000001",

  "metadata": {
    "businessTransactionId": "txn-000001",
    "correlationId": "corr-000001",
    "createdBy": "tutorial-08",
    "createdAt": "2026-01-01T00:00:00Z"
  },

  "authority": {
    "authorityId": "authority-001",
    "authorityType": "USER",
    "principalId": "john.doe",
    "displayName": "John Doe",
    "issuedAt": "2026-01-01T00:00:00Z"
  },

  "authorization": {
    "authorizationId": "authorization-001",
    "authorityId": "authority-001",
    "purpose": "Approve Vendor Payment",
    "authorizedAt": "2026-01-01T00:00:00Z"
  },

  "intent": {
    "intentId": "intent-001",
    "authorizationId": "authorization-001",
    "action": "vendor-payment",
    "resource": "invoice-1001",
    "issuedAt": "2026-01-01T00:00:00Z"
  },

  "policy": {
    "name": "vendor-payment",
    "version": "2.0.0",
    "schemaVersion": "1.0.0"
  },

  "signals": {
    "vendorVerified": true,
    "invoiceVerified": true,
    "paymentApproved": true,
    "sufficientFunds": true,
    "paymentAmount": 5000,
    "riskScore": 10
  },

  "status": "RECEIVED",

  "createdAt": "2026-01-01T00:00:00Z"
}
