{
  "businessTransactionId": "txn-expense-000001",

  "metadata": {
    "businessTransactionId": "txn-expense-000001",
    "correlationId": "corr-expense-000001",
    "createdBy": "expense-portal",
    "createdAt": "2026-01-10T09:00:00Z"
  },

  "authority": {
    "authorityId": "authority-manager-001",
    "authorityType": "USER",
    "principalId": "manager.jane",
    "displayName": "Jane Smith",
    "issuedAt": "2026-01-10T09:15:00Z"
  },

  "authorization": {
    "authorizationId": "authorization-expense-001",
    "authorityId": "authority-manager-001",
    "purpose": "Employee Expense Reimbursement",
    "authorizedAt": "2026-01-10T09:20:00Z"
  },

  "intent": {
    "intentId": "intent-expense-001",
    "authorizationId": "authorization-expense-001",
    "action": "expense-approval",
    "resource": "expense-report-2026-001",
    "issuedAt": "2026-01-10T09:20:00Z"
  },

  "policy": {
    "name": "expense-approval",
    "version": "1.0.0",
    "schemaVersion": "1.0.0"
  },

  "signals": {
    "employeeVerified": true,
    "managerApproved": true,
    "receiptAttached": true,
    "withinPolicyLimit": true,
    "expenseAmount": 850,
    "currency": "USD",
    "riskScore": 5
  },

  "status": "RECEIVED",

  "createdAt": "2026-01-10T09:00:00Z"
}
